{
  "ticker": "FMC US",
  "period": "FY2026 Q2",
  "reported_at": "2026-07-29",
  "generated_at": "2026-08-17T00:00:00.000Z",
  "depth": "kpi-only",
  "headline": "Revenue rebounds but losses widen and leverage climbs",
  "kpis": [
    { "label": "Revenue", "value": "$867.1M", "delta": "+14.3%", "delta_basis": "q/q", "direction": "up" },
    { "label": "Revenue", "value": "$867.1M", "delta": "-17.5%", "delta_basis": "y/y", "direction": "down" },
    { "label": "Gross profit", "value": "$342.1M", "delta": "+38.7%", "delta_basis": "q/q", "direction": "up" },
    { "label": "Gross profit", "value": "$342.1M", "delta": "-15.8%", "delta_basis": "y/y", "direction": "down" },
    { "label": "Operating income", "value": "-$119.7M", "delta": "-$38.7M", "delta_basis": "q/q", "direction": "down" },
    { "label": "Operating income", "value": "-$119.7M", "delta": "-$246.1M", "delta_basis": "y/y", "direction": "down" },
    { "label": "EBITDA", "value": "-$81.9M", "delta": "-$39.5M", "delta_basis": "q/q", "direction": "down" },
    { "label": "EBITDA", "value": "-$81.9M", "delta": "-$245.1M", "delta_basis": "y/y", "direction": "down" },
    { "label": "Net income", "value": "-$186.6M", "delta": "+$94.7M", "delta_basis": "q/q", "direction": "up" },
    { "label": "Net income", "value": "-$186.6M", "delta": "-$253.3M", "delta_basis": "y/y", "direction": "down" },
    { "label": "EPS (diluted)", "value": "-$1.49", "delta": "+$0.76", "delta_basis": "q/q", "direction": "up" },
    { "label": "EPS (diluted)", "value": "-$1.49", "delta": "-$2.02", "delta_basis": "y/y", "direction": "down" },
    { "label": "Total cash", "value": "$476.6M", "delta": "+21.9%", "delta_basis": "q/q", "direction": "up" },
    { "label": "Total cash", "value": "$476.6M", "delta": "+8.8%", "delta_basis": "y/y", "direction": "up" },
    { "label": "Long-term debt", "value": "$3.96B", "delta": "+17.9%", "delta_basis": "q/q", "direction": "up" },
    { "label": "Long-term debt", "value": "$3.96B", "delta": "+18.1%", "delta_basis": "y/y", "direction": "up" },
    { "label": "Short-term debt", "value": "$9.3M", "delta": "-98.4%", "delta_basis": "q/q", "direction": "down" },
    { "label": "Short-term debt", "value": "$9.3M", "delta": "-89.2%", "delta_basis": "y/y", "direction": "down" },
    { "label": "Shareholders' equity", "value": "$1.64B", "delta": "-10.2%", "delta_basis": "q/q", "direction": "down" },
    { "label": "Shareholders' equity", "value": "$1.64B", "delta": "-62.8%", "delta_basis": "y/y", "direction": "down" }
  ],
  "summary_short": "FMC's Q2 2026 revenue was $867.1M, up 14.3% q/q but down 17.5% y/y, while the operating loss widened to $119.7M (from $81M q/q, +$126.4M profit y/y) and diluted EPS was -$1.49 versus -$2.25 q/q and $0.53 y/y.",
  "summary_long": "Revenue was $867.1M (+14.3% q/q, -17.5% y/y). Gross margin was 39.5%, up from 32.5% q/q and roughly flat y/y (38.7%). Operating loss widened to $119.7M (vs -$81M q/q, +$126.4M y/y); EBITDA fell to -$81.9M. Diluted EPS was -$1.49 (vs -$2.25 q/q, $0.53 y/y). Cash rose to $476.6M (+21.9% q/q). Long-term debt grew to $3.96B (+17.9% q/q) while short-term debt fell to $9.3M from $590.1M; equity fell to $1.64B from $4.40B y/y.",
  "source_url": "https://www.sec.gov/Archives/edgar/data/37785/000003778526000139/fmcex991063026.htm",
  "confidence_notes": "primary filing unreachable — KPI-only summary from verified shard data. FORCE-REGENERATED: force-regenerate mode was requested for this run and the Step-0 already-exists guard was deliberately skipped per instruction; this write is a fresh regeneration of data/summaries/FMC_US_FY2026_Q2.json (no prior file existed on disk before this run, so there was nothing literally to overwrite, but the run followed the force-regenerate path throughout). Event sourceLink from resolve-earnings-target.mjs (https://www.sec.gov/Archives/edgar/data/37785/000095010326009902/dp249374_8k.htm, resolved via resolve-edgar-exhibit.mjs to EX-99.1 dp249374_ex9901.htm) turned out to be an unrelated 8-K announcing a $400M Tessenderlo Group minority equity investment, not the Q2 2026 earnings release — a data-quality issue in the stored sourceLink worth correcting in a future backfill pass. The correct earnings 8-K (Items 2.02/9.01) was located via the EDGAR CIK filing index: accession 0000037785-26-000139, filed 2026-07-29, exhibit fmcex991063026.htm — but fetching its content would have been this run's 4th fetch, exceeding the 3-fetch budget after the mismatch was discovered, so per the Step 0.5 downgrade rule this summary is composed KPI-only from the shard's SEC-verbatim data rather than the actual press release; no drivers or guidance were assessed. reported_at is set to 2026-07-29 (the real filing date of the correct earnings 8-K found via the EDGAR index) rather than the shard's stored eventDate of 2026-06-30, which is a fiscal-quarter-end placeholder per this project's real-report-date rule. Step 3b (extended metrics) was still executed per instruction with an empty array, since no earnings-filing text was read within budget to extract non-GAAP/operational KPIs from."
}
