{
  "ticker": "RNG US",
  "period": "FY2026 Q2",
  "reported_at": "2026-06-30",
  "generated_at": "2026-08-18T11:43:41Z",
  "headline": "Subscription growth and cost discipline lift profit",
  "kpis": [
    {
      "label": "Revenue",
      "value": "$657.0M",
      "delta": "+6.0%",
      "delta_basis": "y/y",
      "direction": "up"
    },
    {
      "label": "Gross profit",
      "value": "$472.3M",
      "delta": "+7.0%",
      "delta_basis": "y/y",
      "direction": "up"
    },
    {
      "label": "Operating income",
      "value": "$50.3M",
      "delta": "+36.0%",
      "delta_basis": "y/y",
      "direction": "up"
    },
    {
      "label": "EBITDA",
      "value": "$118.0M",
      "delta": "+35.5%",
      "delta_basis": "y/y",
      "direction": "up"
    },
    {
      "label": "Net income",
      "value": "$39.1M",
      "delta": "+196.5%",
      "delta_basis": "y/y",
      "direction": "up"
    },
    {
      "label": "EPS (diluted)",
      "value": "$0.45",
      "delta": "+221.4%",
      "delta_basis": "y/y",
      "direction": "up"
    },
    {
      "label": "Total cash",
      "value": "$111.5M",
      "delta": "-33.7%",
      "delta_basis": "y/y",
      "direction": "down"
    },
    {
      "label": "Long-term debt",
      "value": "$1,074.4M",
      "delta": "+69.8%",
      "delta_basis": "y/y",
      "direction": "up"
    },
    {
      "label": "Shareholders' equity",
      "value": "-$610.4M",
      "delta": "-25.4%",
      "delta_basis": "y/y",
      "direction": "down"
    },
    {
      "label": "Dividend per share",
      "value": "$0.075",
      "delta": "flat",
      "delta_basis": "q/q",
      "direction": "flat"
    }
  ],
  "summary_short": "Revenue rose 6% year-over-year to $657.0 million as operating income grew 36% to $50.3 million and diluted EPS more than tripled to $0.45, while cash fell to $111.5 million following debt-refinancing activity.",
  "summary_long": "Revenue grew 6% y/y to $657.0 million on subscription growth from new customers and AI-led upsell; gross margin held near 72% despite higher infrastructure costs. Operating income rose 36% to $50.3 million as revenue outpaced R&D, sales, and G&A growth. Net income climbed to $39.1 million, aided by a $15.0 million gain from an amended Avaya agreement. Cash fell to $111.5 million after settling $609.1 million of convertible notes, drawing $600.0 million on the Term Loan, and repurchasing $175.0 million of stock in H1. Dividend held flat at $0.075/share. The 10-Q states no forward guidance.",
  "source_url": "https://www.sec.gov/Archives/edgar/data/1384905/000138490526000046/rng-20260630.htm",
  "confidence_notes": "FORCE-REGENERATED — this summary was produced in force-regenerate mode per instruction; no prior summary file actually existed on disk for this ticker+period at generation time (resolver reported summaryExists=false), so this run created it fresh under the regeneration flag. All KPI deltas use y/y since the 10-Q's own comparative tables present three-months-2026-vs-three-months-2025 (no sequential Q1 2026 column); the resolver's Yahoo-sourced prior_qq values exist but aren't reflected in the filing's own presentation and are omitted here for consistency with the primary document, except dividend per share which is reported q/q (flat at $0.075) since the company paid no dividend in the year-ago quarter (initiated in Q1 2026), making a y/y comparison not meaningful. The y/y jump in long-term debt (+69.8%) and the drop in total cash reflect debt-structure changes, not operating deterioration: the 2026 Convertible Notes ($609.1M, previously a current liability) were settled/matured in the period and replaced with $600.0 million drawn under a new long-term Term Loan, alongside $175.0 million of H1 share repurchases. Shareholders' equity is a deficit (accumulated-deficit driven, common for capital-return-heavy SaaS issuers); the deficit widened y/y primarily on continued buybacks rather than an operating loss. reported_at (2026-06-30) reflects the shard's quarter-end eventDate per schema; the actual 10-Q filing date is 2026-07-23.",
  "depth": "filing",
  "drivers": [
    {
      "metric": "Revenue",
      "direction": "up",
      "explanation": "Subscriptions revenue increased 6% y/y, primarily due to acquisition of new customers and upsell of products, including new AI-led products.",
      "basis": "company-disclosed"
    },
    {
      "metric": "Gross profit",
      "direction": "up",
      "explanation": "Gross margin held near 72% as a $10.2 million rise in infrastructure support costs was largely offset by a $1.9 million decrease in third-party support costs.",
      "basis": "company-disclosed"
    },
    {
      "metric": "Operating income",
      "direction": "up",
      "explanation": "Operating income grew as 6% revenue growth outpaced combined R&D (+7%), sales and marketing (+4%), and G&A (+2%) expense growth.",
      "basis": "derived-arithmetic"
    },
    {
      "metric": "EBITDA",
      "direction": "up",
      "explanation": "Tracks the operating-income improvement described above, plus steady depreciation and amortization.",
      "basis": "derived-arithmetic"
    },
    {
      "metric": "Net income",
      "direction": "up",
      "explanation": "Net income rose on higher operating income plus a $15.0 million gain recognized from an amended agreement with partner Avaya, booked in other income.",
      "basis": "company-disclosed"
    },
    {
      "metric": "EPS (diluted)",
      "direction": "up",
      "explanation": "Follows net income growth, further boosted by a lower diluted share count after continued buybacks.",
      "basis": "derived-arithmetic"
    },
    {
      "metric": "Total cash",
      "direction": "down",
      "explanation": "Cash fell as $609.1 million used to settle maturing 2026 Convertible Notes and $175.0 million of H1 stock repurchases outpaced $600.0 million drawn under the new Term Loan.",
      "basis": "company-disclosed"
    },
    {
      "metric": "Long-term debt",
      "direction": "up",
      "explanation": "Long-term debt rose as $600.0 million was drawn under the Term Loan to help fund settlement of the maturing 2026 Convertible Notes, which had been classified as a current liability.",
      "basis": "company-disclosed"
    },
    {
      "metric": "Shareholders' equity",
      "direction": "down",
      "explanation": "The equity deficit widened as $175.0 million of H1 share repurchases exceeded H1 net income of $69.7 million.",
      "basis": "derived-arithmetic"
    },
    {
      "metric": "Dividend per share",
      "direction": "flat",
      "explanation": "Held at $0.075/share, the same rate declared in Q1 2026, the quarter the company initiated its inaugural dividend payout.",
      "basis": "company-disclosed"
    },
    {
      "metric": "overall",
      "direction": "up",
      "explanation": "MD&A frames the quarter as continued growth from new-customer acquisition and AI-led product upsell, with expense growth held below revenue growth across R&D, sales, and G&A.",
      "basis": "company-disclosed"
    }
  ]
}
