{
  "ticker": "BSY US",
  "period": "FY2026 Q1",
  "reported_at": "2026-03-31",
  "generated_at": "2026-08-14T13:25:00.000Z",
  "depth": "filing",
  "headline": "Subscription growth accelerates; cash flow cools on timing",
  "kpis": [
    { "label": "Revenue", "value": "$424.2M", "delta": "+8.3%", "delta_basis": "q/q", "direction": "up" },
    { "label": "Revenue", "value": "$424.2M", "delta": "+14.5%", "delta_basis": "y/y", "direction": "up" },
    { "label": "Gross profit", "value": "$350.4M", "delta": "+9.3%", "delta_basis": "q/q", "direction": "up" },
    { "label": "Gross profit", "value": "$350.4M", "delta": "+14.9%", "delta_basis": "y/y", "direction": "up" },
    { "label": "Operating income", "value": "$126.3M", "delta": "+60.8%", "delta_basis": "q/q", "direction": "up" },
    { "label": "Operating income", "value": "$126.3M", "delta": "+9.6%", "delta_basis": "y/y", "direction": "up" },
    { "label": "EBIT", "value": "$126.1M", "delta": "+48.3%", "delta_basis": "q/q", "direction": "up" },
    { "label": "EBIT", "value": "$126.1M", "delta": "+10.3%", "delta_basis": "y/y", "direction": "up" },
    { "label": "EBITDA", "value": "$142.3M", "delta": "+41.1%", "delta_basis": "q/q", "direction": "up" },
    { "label": "EBITDA", "value": "$142.3M", "delta": "+9.4%", "delta_basis": "y/y", "direction": "up" },
    { "label": "Net income", "value": "$95.4M", "delta": "+62.7%", "delta_basis": "q/q", "direction": "up" },
    { "label": "Net income", "value": "$95.4M", "delta": "+4.4%", "delta_basis": "y/y", "direction": "up" },
    { "label": "EPS diluted (GAAP)", "value": "$0.30", "delta": "+66.7%", "delta_basis": "q/q", "direction": "up" },
    { "label": "EPS diluted (GAAP)", "value": "$0.30", "delta": "+7.1%", "delta_basis": "y/y", "direction": "up" },
    { "label": "Operating cash flow", "value": "$193.4M", "delta": "-11.9%", "delta_basis": "y/y", "direction": "down" },
    { "label": "Capex", "value": "$5.6M", "delta": "+82.4%", "delta_basis": "y/y", "direction": "up" },
    { "label": "Total cash", "value": "$105.2M", "delta": "-14.7%", "delta_basis": "q/q", "direction": "down" },
    { "label": "Total cash", "value": "$105.2M", "delta": "+25.7%", "delta_basis": "y/y", "direction": "up" },
    { "label": "Long-term debt", "value": "$1,115.3M", "delta": "-10.7%", "delta_basis": "q/q", "direction": "down" },
    { "label": "Long-term debt", "value": "$1,115.3M", "delta": "-10.4%", "delta_basis": "y/y", "direction": "down" },
    { "label": "Shareholders' equity", "value": "$1,225.8M", "delta": "+3.1%", "delta_basis": "q/q", "direction": "up" },
    { "label": "Shareholders' equity", "value": "$1,225.8M", "delta": "+11.7%", "delta_basis": "y/y", "direction": "up" }
  ],
  "summary_short": "Bentley Systems' Q1 2026 revenue rose 14.5% y/y to $424.2M on broad subscription strength across all geographies, while operating cash flow fell 11.9% y/y to $193.4M on working-capital timing.",
  "summary_long": "Revenue grew 14.5% y/y (11.9% constant currency) to $424.2M, led by Enterprise and SELECT subscriptions with growth from existing accounts and 3% from new accounts; all three geographies grew double digits. Gross margin held near 82.6%. Opex rose 18.2% on higher headcount costs across R&D, sales, and G&A. Operating income reached $126.3M, up sharply q/q against a soft Q4 2025 base. Net income was $95.4M ($0.30 diluted EPS). Operating cash flow fell to $193.4M on working-capital timing (payables, receivables collections, Cloud Services deposits). The company repaid $678.3M of maturing 2026 Notes via Credit Facility borrowings and cash, and repurchased $40.0M of stock. No numeric FY2026 guidance was given in this 10-Q.",
  "source_url": "https://www.sec.gov/Archives/edgar/data/1031308/000103130826000017/bsy-20260331.htm",
  "confidence_notes": "REGENERATION: this run was invoked in force-regenerate mode with the Step-0 'already exists' guard explicitly skipped, per instruction. Note: no prior BSY_US_FY2026_Q1.json summary actually existed on disk before this run (resolver reported summaryExists=false) — this is a first-time compose, not a literal overwrite, despite the force-regen framing of the request. All KPI values from resolve-earnings-target.mjs reconciled exactly against the fetched 10-Q (revenue, gross profit, net income, basic/diluted EPS, cost of revenue, pretax income, operating cash flow, capex, cash, long-term debt, and shareholders' equity all match to the reported dollar/cent). One minor discrepancy: the resolver's Yahoo-derived 'ebit_usd_m' ($126.111M) differs slightly from the SEC-verbatim GAAP 'Income from operations' line ($126.260M); both are carried as separate KPI rows since the filing does not itemize the ~$0.15M gap. This is a 10-Q, not an earnings press release — it contains no numeric forward-looking guidance range for revenue, EPS, or any other metric (only a qualitative note that G&A will begin including internal-use-software amortization starting in 2026), so the shard's guidance array was left untouched. Step 3b extracted four extended metrics (arr, capex_total, buyback_qtr_usd, dividend_per_share) with exact filing quotes; capex_adjusted, free_cash_flow_mgmt, sale_of_assets_usd, eps_non_gaap, both next-quarter guidance metrics, wafer_starts, and capex_intensity were omitted as not disclosed or (capex_intensity) requiring computation rather than a direct filing quote.",
  "drivers": [
    { "metric": "overall", "direction": "up", "explanation": "Q1 2026 continued Bentley's subscription-led growth (revenue +14.5% y/y) with double-digit growth in all three geographies; cash flow softened on working-capital timing and the company repaid its maturing 2026 convertible notes using Credit Facility borrowings.", "basis": "company-disclosed" },
    { "metric": "Revenue", "direction": "up", "explanation": "Driven by subscriptions revenue expansion from existing accounts, plus 3% growth from new accounts (led by small- and medium-sized), most notably Bentley Open Applications, Seequent, and Bentley Infrastructure Cloud; partially offset by a decline in perpetual licenses revenue.", "basis": "company-disclosed" },
    { "metric": "Gross profit", "direction": "up", "explanation": "Gross profit growth (14.9% y/y) outpaced cost of revenue growth (12.4% y/y), which rose mainly on higher cloud-related costs and headcount-related service costs per the release.", "basis": "derived-arithmetic" },
    { "metric": "Operating income", "direction": "up", "explanation": "Gross profit rose $45.5M y/y while operating expenses rose $34.4M (headcount-related costs across R&D, sales, and G&A, per the release), so the larger absolute gross-profit gain lifted operating income.", "basis": "derived-arithmetic" },
    { "metric": "EBIT", "direction": "up", "explanation": "Tracks the same operating-income dynamics; the resolver's Yahoo-derived EBIT ($126.1M) differs marginally from GAAP operating income ($126.3M), a gap not itemized in the filing.", "basis": "derived-arithmetic" },
    { "metric": "EBITDA", "direction": "up", "explanation": "Tracks the same operating-income dynamics plus a depreciation and amortization add-back; not separately reconciled by the company in this filing.", "basis": "derived-arithmetic" },
    { "metric": "Net income", "direction": "up", "explanation": "Tracks the operating-income growth, partially offset by higher interest expense (up 115.3% y/y) following higher weighted-average debt and rates after the January 2026 repayment of the 2026 Notes.", "basis": "company-disclosed" },
    { "metric": "EPS diluted (GAAP)", "direction": "up", "explanation": "Tracks higher net income; weighted diluted shares fell to 321.8M from 333.4M y/y on stock repurchases, a modest additional lift to per-share income.", "basis": "derived-arithmetic" },
    { "metric": "Operating cash flow", "direction": "down", "explanation": "Fell primarily on a $38.4M decrease in cash flows from working-capital changes (lower accounts payable, receivables-collection timing, and lower Cloud Services Subscription deposits), partly offset by higher net income and non-cash adjustments.", "basis": "company-disclosed" },
    { "metric": "Capex", "direction": "up", "explanation": "not explained in the release beyond restating that purchases of property, equipment, and capitalized software were higher than the prior-year period.", "basis": "company-disclosed" },
    { "metric": "Total cash", "direction": "down", "explanation": "Cash fell q/q (but rose y/y) as the January 2026 repayment of $678.3M in maturing 2026 Notes and $40.0M of stock buybacks were the quarter's primary cash uses, funded via Credit Facility borrowings.", "basis": "company-disclosed" },
    { "metric": "Long-term debt", "direction": "down", "explanation": "Debt fell as the company repaid $678.3M of 2026 Notes at their January 2026 maturity using Credit Facility borrowings and cash; a new $550.0M Term Loan was added after quarter-end (April 2026) to refinance revolver borrowings.", "basis": "company-disclosed" },
    { "metric": "Shareholders' equity", "direction": "up", "explanation": "Growth reflects the quarter's $95.4M net income plus stock-based compensation and share issuances, partly offset by $40.0M of Class B buybacks and $21.2M of dividends; not further reconciled in the MD&A.", "basis": "derived-arithmetic" }
  ]
}
