{
  "ticker": "SSD US",
  "period": "FY2026 Q2",
  "reported_at": "2026-07-27",
  "generated_at": "2026-08-18T14:02:57.000Z",
  "depth": "filing",
  "headline": "Pricing and cost discipline drive record margins",
  "kpis": [
    { "label": "Revenue", "value": "$671.1M", "delta": "+14.1%", "delta_basis": "q/q", "direction": "up" },
    { "label": "Revenue", "value": "$671.1M", "delta": "+6.3%", "delta_basis": "y/y", "direction": "up" },
    { "label": "Cost of revenue", "value": "$352.9M", "delta": "+9.6%", "delta_basis": "q/q", "direction": "up" },
    { "label": "Cost of revenue", "value": "$352.9M", "delta": "+4.8%", "delta_basis": "y/y", "direction": "up" },
    { "label": "Gross profit", "value": "$318.2M", "delta": "+19.7%", "delta_basis": "q/q", "direction": "up" },
    { "label": "Gross profit", "value": "$318.2M", "delta": "+8.6%", "delta_basis": "y/y", "direction": "up" },
    { "label": "Operating income", "value": "$169.1M", "delta": "+47.6%", "delta_basis": "q/q", "direction": "up" },
    { "label": "Operating income", "value": "$169.1M", "delta": "+20.8%", "delta_basis": "y/y", "direction": "up" },
    { "label": "Pretax income", "value": "$170.9M", "delta": "+46.9%", "delta_basis": "q/q", "direction": "up" },
    { "label": "Pretax income", "value": "$170.9M", "delta": "+22.5%", "delta_basis": "y/y", "direction": "up" },
    { "label": "Net income", "value": "$127.0M", "delta": "+44.0%", "delta_basis": "q/q", "direction": "up" },
    { "label": "Net income", "value": "$127.0M", "delta": "+22.7%", "delta_basis": "y/y", "direction": "up" },
    { "label": "EPS (basic)", "value": "$3.10", "delta": "+44.9%", "delta_basis": "q/q", "direction": "up" },
    { "label": "EPS (basic)", "value": "$3.10", "delta": "+25.0%", "delta_basis": "y/y", "direction": "up" },
    { "label": "EPS (diluted)", "value": "$3.09", "delta": "+45.1%", "delta_basis": "q/q", "direction": "up" },
    { "label": "EPS (diluted)", "value": "$3.09", "delta": "+25.1%", "delta_basis": "y/y", "direction": "up" },
    { "label": "Total cash", "value": "$450.5M", "delta": "+32.1%", "delta_basis": "q/q", "direction": "up" },
    { "label": "Total cash", "value": "$450.5M", "delta": "+136.6%", "delta_basis": "y/y", "direction": "up" },
    { "label": "Long-term debt", "value": "$292.5M", "delta": "-1.3%", "delta_basis": "q/q", "direction": "down" },
    { "label": "Long-term debt", "value": "$292.5M", "delta": "-22.4%", "delta_basis": "y/y", "direction": "down" },
    { "label": "Short-term debt", "value": "$15.0M", "delta": "0.0%", "delta_basis": "q/q", "direction": "flat" },
    { "label": "Short-term debt", "value": "$15.0M", "delta": "-33.3%", "delta_basis": "y/y", "direction": "down" },
    { "label": "Shareholders' equity", "value": "$2,117.8M", "delta": "+2.9%", "delta_basis": "q/q", "direction": "up" },
    { "label": "Shareholders' equity", "value": "$2,117.8M", "delta": "+9.7%", "delta_basis": "y/y", "direction": "up" },
    { "label": "Weighted diluted shares", "value": "41.1M", "delta": "-0.7%", "delta_basis": "q/q", "direction": "down" },
    { "label": "Weighted diluted shares", "value": "41.1M", "delta": "-1.8%", "delta_basis": "y/y", "direction": "down" }
  ],
  "summary_short": "Second-quarter net sales rose 6.3% year-over-year to $671.1 million, with operating margin expanding 300 basis points to 25.2% and diluted EPS up 25.1% to $3.09. The company raised its 2026 share repurchase authorization by $50 million and updated full-year guidance.",
  "summary_long": "Net sales grew 6.3% y/y to $671.1M, led by North America pricing (+6.0%) and Europe volume/price/FX gains (+7.6%, a record 13.7% operating margin). Gross margin expanded 100bp to 47.4% on lower material costs and cost savings; operating margin rose 300bp to 25.2%, aided by a $5.5M eminent domain settlement. Net income rose 22.7% to $127.0M; diluted EPS rose 25.1% to $3.09 on the net income gain plus a 1.8% y/y buyback-driven share-count reduction. Operating cash flow rose $89.8M y/y to $215.0M; cash ended at $450.5M. Board raised the buyback authorization to $200.0M and declared a $0.30/share dividend. FY2026 outlook updated: operating margin 19.7%-20.5% (includes a $10.0M-$12.0M land-sale gain), tax rate 25.0%-26.0%, capex $80.0M-$90.0M.",
  "drivers": [
    {
      "metric": "overall",
      "direction": "up",
      "explanation": "Management frames the quarter as solid execution across operations, with pricing actions, European volume growth, and cost-savings initiatives driving margin expansion alongside a one-time eminent domain settlement gain.",
      "basis": "company-disclosed"
    },
    {
      "metric": "Revenue",
      "direction": "up",
      "explanation": "North America growth (+6.0%) driven by 2025 tariff-related pricing actions, partly offset by lower unit volumes on a softer market; Europe growth (+7.6%) from higher unit volumes, price increases, and ~$3.7M favorable FX.",
      "basis": "company-disclosed"
    },
    {
      "metric": "Gross profit",
      "direction": "up",
      "explanation": "Margin expanded 100bp to 47.4% on lower material costs as a percentage of sales and cost-savings initiatives; North America margin rose to 50.2% from 49.5%, Europe to 38.2% from 36.2%.",
      "basis": "company-disclosed"
    },
    {
      "metric": "Operating income",
      "direction": "up",
      "explanation": "Margin rose 300bp to 25.2%, including a 100bp benefit from a $5.5M eminent domain settlement plus 2025 strategic cost-savings initiatives and higher gross profit.",
      "basis": "company-disclosed"
    },
    {
      "metric": "EPS (diluted)",
      "direction": "up",
      "explanation": "Diluted EPS growth (25.1%) exceeded net income growth (22.7%) on a 1.8% y/y reduction in weighted diluted shares from the quarter's $48.7M buyback.",
      "basis": "derived-arithmetic"
    },
    {
      "metric": "Total cash",
      "direction": "up",
      "explanation": "Operating cash flow rose $89.8M y/y to $215.0M on higher net income and working-capital changes; investing outflows fell $31.9M y/y to $8.6M on lower capital expenditures.",
      "basis": "company-disclosed"
    },
    {
      "metric": "Long-term debt",
      "direction": "down",
      "explanation": "Not explained in the release; no debt-repayment or refinancing narrative is given for the y/y decline.",
      "basis": "company-disclosed"
    }
  ],
  "source_url": "https://www.sec.gov/Archives/edgar/data/920371/000162828026049817/q22026ex991pressrelease.htm",
  "confidence_notes": "REGENERATION (force-regen run): this run OVERWRITES any prior data/summaries/SSD_US_FY2026_Q2.json per the explicit force-regenerate directive; the resolver reported summaryExists=false, so this is also the first-ever summary for this period, not just a refresh. SOURCE-LADDER NOTE: the shard's stored sourceLink pointed to SSD's 8-K cover document (ssd-20260727.htm); resolve-edgar-exhibit.mjs correctly resolved it to the EX-99.1 press release (q22026ex991pressrelease.htm), which is this summary's actual primary source and is cited as source_url. RECAST BASIS: the company reclassified certain software-amortization and quality-assurance costs from G&A to cost of sales starting FY2026 Q1 (and recast for the year ended Dec 31, 2025); the press release's own year-over-year comparison table uses recast prior-year figures (e.g. cost of sales $338.164M, income from operations $140.244M for Q2 2025), while this summary's q/q and y/y KPI deltas use the resolver's shard-stored SEC EDGAR / Yahoo prior-period values (e.g. cost of revenue prior_yy $336.605M, operating income prior_yy $140.052M) per the /earnings procedure's rule to source KPI values from Step 0's kpis object rather than re-deriving from the document. The resulting delta percentages are consequently close to but not identical to the press release's own stated y/y percentages (e.g. this summary's revenue +6.3% y/y and operating income +20.8% y/y vs the release's own +6.3% and +20.6%) — differences are immaterial and attributable to the recast. LEDGER INCONSISTENCY (not massaged): the shard's long_term_debt_usd_m ($292.5M) + short_term_debt_usd_m ($15.0M) = $307.5M does not reconcile with either the press release's condensed balance sheet (long-term debt, net of current portion and issuance costs, $318.389M as of June 30, 2026) or its narrative 'total debt outstanding of $336.7 million' — the SEC XBRL LongTermDebt tag used by the resolver appears to represent a different debt concept (e.g. gross principal excluding unamortized issuance costs, or a differently-scoped instrument set) than the balance-sheet presentation lines. Flagged per the procedure's instruction to note, not correct, a ledger inconsistency; the KPI value and deltas above are left as the resolver reported them. GUIDANCE: FY2026 outlook was updated (operating margin 19.7%-20.5%, including a projected $10.0M-$12.0M land-sale gain; effective tax rate 25.0%-26.0%; capex $80.0M-$90.0M) — written to the event's guidance[] array with move=null because the release states it is 'updating its prior 2026 financial outlook' without characterizing any individual line as raised, lowered, or held. EXTENDED METRICS: of the universal + industrials registry set, only buyback ($48.7M repurchased this quarter) and dividend per share ($0.30) were stated explicitly enough to clear the >=0.7 confidence bar; capex, free cash flow, sale-of-assets proceeds, non-GAAP EPS, backlog, book-to-bill, organic growth %, and next-quarter guidance were either not disclosed at quarterly granularity or not labeled as such in this release."
}
