{
  "ticker": "DECK US",
  "period": "FY2026 Q2",
  "reported_at": "2026-07-23",
  "generated_at": "2026-08-10T00:00:00Z",
  "headline": "HOKA and UGG lift revenue past a milestone; profit dips",
  "depth": "filing",
  "kpis": [
    { "label": "Revenue", "value": "$1,019.5M", "delta": "+5.7%", "delta_basis": "y/y", "direction": "up" },
    { "label": "Gross profit", "value": "$575.2M", "delta": "+6.9%", "delta_basis": "y/y", "direction": "up" },
    { "label": "Operating income", "value": "$155.3M", "delta": "-6.0%", "delta_basis": "y/y", "direction": "down" },
    { "label": "Net income", "value": "$130.0M", "delta": "-6.6%", "delta_basis": "y/y", "direction": "down" },
    { "label": "Diluted EPS", "value": "$0.94", "delta": "+1.1%", "delta_basis": "y/y", "direction": "up" },
    { "label": "EBITDA", "value": "$189.0M", "delta": "-7.1%", "delta_basis": "y/y", "direction": "down" },
    { "label": "Operating cash flow", "value": "$47.9M", "delta": "+32.5%", "delta_basis": "y/y", "direction": "up" },
    { "label": "Capital expenditures", "value": "$15.2M", "delta": "-36.4%", "delta_basis": "y/y", "direction": "down" },
    { "label": "Cash and cash equivalents", "value": "$1,602.6M", "delta": "-6.8%", "delta_basis": "y/y", "direction": "down" },
    { "label": "Shareholders' equity", "value": "$2,301.7M", "delta": "-6.7%", "delta_basis": "y/y", "direction": "down" },
    { "label": "Weighted diluted shares outstanding", "value": "138.6M shares", "delta": "-7.4%", "delta_basis": "y/y", "direction": "down" }
  ],
  "summary_short": "Deckers posted $1,019.5M of quarterly revenue (+5.7% y/y), its first time above $1B for this quarter, on HOKA (+7.7%) and UGG (+4.9%) growth, but net income fell 6.6% to $130.0M as SG&A growth outpaced gross profit. The company repurchased $338.2M of stock and raised full-year diluted EPS guidance to $7.35-$7.50.",
  "summary_long": "Revenue rose 5.7% y/y to $1,019.5M on HOKA (+7.7%) and UGG (+4.9%) strength, partly offset by Other brands' Koolaburra wind-down (-18.1%). Gross margin improved to 56.4% from 55.8%, but SG&A grew faster ($419.9M vs $372.6M), pulling operating income down 6.0% to $155.3M and net income down 6.6% to $130.0M. Diluted EPS still rose to $0.94 as the diluted share count fell 7.4% on buybacks. Cash fell to $1.603B (from $1.720B) after a $338.2M repurchase this quarter. Full-year EPS guidance was raised to $7.35-$7.50 (+$0.05); revenue guidance held at $5.86B-$5.91B.",
  "drivers": [
    { "metric": "Revenue", "direction": "up", "explanation": "HOKA net sales grew 7.7% and UGG grew 4.9% on global demand; Other brands fell 18.1% on the Koolaburra standalone wind-down; DTC (+13.0%) and international (+8.4%) outgrew wholesale and domestic.", "basis": "company-disclosed" },
    { "metric": "Gross profit", "direction": "up", "explanation": "Gross margin expanded to 56.4% from 55.8% y/y; the release does not state a specific driver for the improvement.", "basis": "company-disclosed" },
    { "metric": "Operating income", "direction": "down", "explanation": "Gross profit grew 6.9% to $575.2M but SG&A grew about 12.7% to $419.9M, so expense growth outpaced gross-profit growth and operating income fell 6.0%.", "basis": "derived-arithmetic" },
    { "metric": "Net income", "direction": "down", "explanation": "Net income fell in line with the operating income decline; other income was smaller than a year ago, and a lower tax expense only partly offset the drop.", "basis": "derived-arithmetic" },
    { "metric": "Diluted EPS", "direction": "up", "explanation": "EPS rose despite lower net income because the diluted share count fell 7.4% y/y on buybacks, more than offsetting the income decline.", "basis": "derived-arithmetic" },
    { "metric": "Cash and cash equivalents", "direction": "down", "explanation": "Cash was used to fund a $338.2M share repurchase (about 3.3M shares at a $103.79 average price) executed this quarter; the company remains debt-free.", "basis": "company-disclosed" },
    { "metric": "overall", "direction": "up", "explanation": "Management framed the quarter as a solid start to the fiscal year on HOKA/UGG demand, and raised full-year diluted EPS guidance to $7.35-$7.50 despite higher SG&A pressuring GAAP operating income.", "basis": "company-disclosed" }
  ],
  "source_url": "https://www.sec.gov/Archives/edgar/data/910521/000091052126000015/deckex991pressrelease-6302.htm",
  "confidence_notes": "REGENERATED SUMMARY (force-regenerate mode, Step-0 already-exists guard skipped per explicit request) — note for the record: no prior summary file existed on disk for DECK_US_FY2026_Q2 at run time, so this run created rather than literally overwrote a file; treat this note as satisfying the regeneration-disclosure requirement. Filing-based summary from Exhibit 99.1 of the July 23, 2026 8-K; the cover document (deck-20260723.htm) only pointed at the exhibit, so resolve-edgar-exhibit.mjs was used to locate deckex991pressrelease-6302.htm before fetching. KPI values quoted from the release's condensed income statement and balance sheet tables and cross-checked against the resolver's SEC-verbatim shard data (exact match). Deltas are y/y per the release's own 'Compared to the Same Period Last Year' framing; q/q deltas were not used because several fields (operating cash flow, capex, weighted shares) have no q/q prior on the shard. PERIOD-LABEL FLAG: the release itself titles this 'First Quarter Fiscal Year 2027' (quarter ended June 30, 2026, Deckers' fiscal year ends March 31) — the same fiscal-offset pattern CLAUDE.md documents for other Apr-Mar issuers. Our shard/resolver labels this event 'FY2026 Q2' under a calendar-quarter convention applied consistently across DECK's other shard events, so the summary filename/period follows the shard's existing convention rather than introducing a one-off relabel; flagging here per ledger discipline. Non-GAAP guidance metrics (gross margin, operating margin) are described by the release as 'now expected' vs. 'still expected' for unchanged lines, suggesting a change, but no specific prior numeric value is given for those two, so guidance move for them is left null rather than asserting 'raised' without an explicit prior figure."
}
