{
  "ticker": "EBAY US",
  "period": "FY2026 Q2",
  "reported_at": "2026-08-05",
  "generated_at": "2026-08-10T00:00:00.000Z",
  "depth": "filing",
  "headline": "Growth accelerates as margins expand and outlook rises",
  "kpis": [
    { "label": "Revenue", "value": "$3,134M", "delta": "+1.5%", "delta_basis": "q/q", "direction": "up" },
    { "label": "Revenue", "value": "$3,134M", "delta": "+14.8%", "delta_basis": "y/y", "direction": "up" },
    { "label": "EPS basic", "value": "$1.24", "delta": "+8.8%", "delta_basis": "q/q", "direction": "up" },
    { "label": "EPS basic", "value": "$1.24", "delta": "+57.0%", "delta_basis": "y/y", "direction": "up" },
    { "label": "EPS diluted", "value": "$1.21", "delta": "+8.0%", "delta_basis": "q/q", "direction": "up" },
    { "label": "EPS diluted", "value": "$1.21", "delta": "+55.1%", "delta_basis": "y/y", "direction": "up" },
    { "label": "Cost of revenue", "value": "$832M", "delta": "+3.7%", "delta_basis": "q/q", "direction": "up" },
    { "label": "Cost of revenue", "value": "$832M", "delta": "+10.9%", "delta_basis": "y/y", "direction": "up" },
    { "label": "Gross profit", "value": "$2,302M", "delta": "+0.7%", "delta_basis": "q/q", "direction": "up" },
    { "label": "Gross profit", "value": "$2,302M", "delta": "+16.3%", "delta_basis": "y/y", "direction": "up" },
    { "label": "Operating income", "value": "$676M", "delta": "+10.6%", "delta_basis": "q/q", "direction": "up" },
    { "label": "Operating income", "value": "$676M", "delta": "+41.1%", "delta_basis": "y/y", "direction": "up" },
    { "label": "Pretax income", "value": "$665M", "delta": "+7.6%", "delta_basis": "q/q", "direction": "up" },
    { "label": "Pretax income", "value": "$665M", "delta": "+40.9%", "delta_basis": "y/y", "direction": "up" },
    { "label": "Net income", "value": "$550M", "delta": "+7.4%", "delta_basis": "q/q", "direction": "up" },
    { "label": "Net income", "value": "$550M", "delta": "+51.1%", "delta_basis": "y/y", "direction": "up" },
    { "label": "EBIT", "value": "$730M", "delta": "+7.5%", "delta_basis": "q/q", "direction": "up" },
    { "label": "EBIT", "value": "$730M", "delta": "+35.4%", "delta_basis": "y/y", "direction": "up" },
    { "label": "EBITDA", "value": "$831M", "delta": "+7.6%", "delta_basis": "q/q", "direction": "up" },
    { "label": "EBITDA", "value": "$831M", "delta": "+23.5%", "delta_basis": "y/y", "direction": "up" },
    { "label": "Total cash", "value": "$2,310M", "delta": "-20.2%", "delta_basis": "q/q", "direction": "down" },
    { "label": "Total cash", "value": "$2,310M", "delta": "+11.6%", "delta_basis": "y/y", "direction": "up" },
    { "label": "Short-term debt", "value": "$850M", "delta": "+13.3%", "delta_basis": "q/q", "direction": "up" },
    { "label": "Short-term debt", "value": "$850M", "delta": "-27.7%", "delta_basis": "y/y", "direction": "down" },
    { "label": "Shareholders' equity", "value": "$4,665M", "delta": "+5.7%", "delta_basis": "q/q", "direction": "up" },
    { "label": "Shareholders' equity", "value": "$4,665M", "delta": "+0.9%", "delta_basis": "y/y", "direction": "up" },
    { "label": "Weighted diluted shares", "value": "455M", "delta": "-0.4%", "delta_basis": "q/q", "direction": "down" },
    { "label": "Weighted diluted shares", "value": "455M", "delta": "-3.2%", "delta_basis": "y/y", "direction": "down" }
  ],
  "summary_short": "eBay reported Q2 FY2026 revenue of $3,134M, up 14.8% y/y and 1.5% q/q, while diluted EPS of $1.21 rose 55.1% y/y as GAAP operating margin expanded to 21.6% from 17.6% a year ago.",
  "summary_long": "Revenue rose 14.8% y/y and 1.5% q/q to $3,134M, driven by 15% GMV growth (to $22.4B) and first-party advertising revenue up 25% y/y. GAAP operating income of $676M (+41.1% y/y) lifted operating margin to 21.6% from 17.6%, aided by a sharp drop in restructuring charges ($1M vs $55M) and a swing in legal-matter costs. Net income of $550M (+51.1% y/y) and diluted EPS of $1.21 (+55.1% y/y) also benefited from a lower GAAP tax rate (17.1% vs 22.6%). Cash fell to $2,310M q/q on a $750M senior-note repayment and continued buybacks ($310M) and dividends ($138M). eBay raised full-year revenue and EPS outlook, and guided Q3 2026 revenue of $3.07-3.12B and non-GAAP diluted EPS of $1.36-1.42.",
  "source_url": "https://www.sec.gov/Archives/edgar/data/1065088/000106508826000174/exhibit991erebayq22026.htm",
  "confidence_notes": "REGENERATION MODE (force-regenerate, operator instruction dated 2026-08-10): this run was explicitly told to skip the Step-0 'already exists' guard and force a fresh compose; for the record, no prior EBAY_US_FY2026_Q2 summary file existed on disk at run start (resolver reported summaryExists=false), so this is an initial compose rather than an actual overwrite. Shard KPI 'short_term_debt_usd_m' ($850M, XBRL tag LongTermDebtCurrent) captures only the current portion of long-term debt, not the release's full balance-sheet 'Short-term debt' line of $1,593M (which also includes roughly $743M of outstanding commercial paper); this summary's short-term-debt KPI reflects the narrower shard figure, not the release's total. EBIT/EBITDA are Yahoo-derived figures, not release-disclosed non-GAAP measures, and differ from the release's own GAAP operating income ($676M) and non-GAAP operating income ($893M).",
  "drivers": [
    { "metric": "Revenue", "direction": "up", "explanation": "GMV rose 15% (14% FX-neutral) to $22.4B on broad-based marketplace demand, plus first-party advertising revenue up 25% y/y.", "basis": "company-disclosed" },
    { "metric": "Operating income", "direction": "up", "explanation": "GAAP operating margin expanded to 21.6% from 17.6%, aided by lower restructuring/executive-bonus charges ($1M vs $55M) and a swing in legal-matter costs.", "basis": "company-disclosed" },
    { "metric": "Net income", "direction": "up", "explanation": "Net income growth was aided by a lower GAAP effective tax rate of 17.1%, down from 22.6% a year ago.", "basis": "company-disclosed" },
    { "metric": "Weighted diluted shares", "direction": "down", "explanation": "Diluted share count fell 3.2% y/y as the company repurchased $310M of stock in the quarter, continuing its buyback program.", "basis": "company-disclosed" },
    { "metric": "overall", "direction": "up", "explanation": "Management raised full-year revenue and EPS outlook citing strong momentum, and guided Q3 2026 revenue of $3.07-3.12B and non-GAAP diluted EPS of $1.36-1.42, which reflect the newly closed Depop acquisition.", "basis": "company-disclosed" }
  ]
}
