{
  "ticker": "DAR US",
  "period": "FY2026 Q2",
  "reported_at": "2026-07-30",
  "generated_at": "2026-08-14T15:00:52.000Z",
  "depth": "filing",
  "headline": "DGD windfall drives a blowout profit quarter",
  "kpis": [
    {
      "label": "Revenue",
      "value": "$1.72B",
      "delta": "+11.2%",
      "delta_basis": "q/q",
      "direction": "up"
    },
    {
      "label": "Gross profit",
      "value": "$503.4M",
      "delta": "+24.3%",
      "delta_basis": "q/q",
      "direction": "up"
    },
    {
      "label": "EBITDA",
      "value": "$685.6M",
      "delta": "+90.1%",
      "delta_basis": "q/q",
      "direction": "up"
    },
    {
      "label": "EBIT",
      "value": "$555.4M",
      "delta": "+141.7%",
      "delta_basis": "q/q",
      "direction": "up"
    },
    {
      "label": "Operating income",
      "value": "$555.2M",
      "delta": "+144.9%",
      "delta_basis": "q/q",
      "direction": "up"
    },
    {
      "label": "Net income",
      "value": "$387.3M",
      "delta": "+188.4%",
      "delta_basis": "q/q",
      "direction": "up"
    },
    {
      "label": "EPS (diluted)",
      "value": "$2.41",
      "delta": "+190.4%",
      "delta_basis": "q/q",
      "direction": "up"
    },
    {
      "label": "Cash",
      "value": "$160.7M",
      "delta": "+38.5%",
      "delta_basis": "q/q",
      "direction": "up"
    }
  ],
  "summary_short": "Darling Ingredients earned $387.3M ($2.41 diluted EPS) in Q2 2026, up sharply from $12.7M ($0.08 EPS) a year ago, as Diamond Green Diesel's equity income swung to $350.0M from $6.0M and combined Adjusted EBITDA rose to $741.7M from $249.5M y/y.",
  "summary_long": "Total net sales rose to $1.72B, up 11.2% q/q and 16.4% y/y, with Feed Ingredients the largest contributor (+22.7% y/y). Operating income jumped to $555.2M from $75.9M a year ago, almost entirely reflecting Diamond Green Diesel's equity income swinging to $350.0M from $6.0M as DGD sold 348.8M gallons at $2.23/gal EBITDA. Net income reached $387.3M ($2.41 diluted EPS) versus $12.7M ($0.08) a year ago. The company received $280.0M in DGD cash distributions, repurchased $73.0M of stock, and cut net debt by $223.0M to $3.79B (2.30x leverage); cash rose to $160.7M. For Q3 2026, core ingredients (ex-DGD) Adjusted EBITDA is guided to $325-340M; FY2026 capex estimated at $450.0M and year-end net debt targeted at or below $3B with leverage below 2x.",
  "source_url": "https://www.sec.gov/Archives/edgar/data/916540/000091654026000019/exh991-pressreleaseq22026.htm",
  "confidence_notes": "REGENERATION: this summary was force-regenerated per explicit request, skipping the Step-0 summaryReady guard (no prior summary file existed on disk for DAR US FY2026 Q2, so this is also a first-print, not an overwrite of a differing prior version). Source-ladder note: resolve-earnings-target.mjs's sourceLink pointed at the 8-K cover document (dar-20260730.htm); resolve-edgar-exhibit.mjs correctly resolved it to the EX-99.1 press-release exhibit (exh991-pressreleaseq22026.htm), which was fetched and read directly. Equity-method quirk: Darling accounts for its 50%-owned Diamond Green Diesel joint venture via the equity method, so 'Equity in net income of Diamond Green Diesel' ($350.0M this quarter vs $6.0M a year ago) flows straight into consolidated operating income and is the single largest swing factor behind the operating income, EBIT, EBITDA and net income beats — not underlying core-ingredients margin expansion. EBITDA/EBIT KPI rows are Yahoo fundamentals-timeseries figures ($685.6M / $555.4M) and are computed differently from the company's own non-GAAP measures disclosed in the release (standalone Adjusted EBITDA of $352.5M excluding DGD's share, or Combined Adjusted EBITDA of $741.7M including DGD's Darling-share) — same underlying quarter, different methodology, not a data error. The non-core grease-trap environmental-services divestiture (~$90.0M, closed July 22, 2026) fell after the July 4, 2026 quarter end, so it was excluded from extendedMetrics as a subsequent event rather than a Q2 item. Four guidance entries (Q3 2026 core-ingredients Adjusted EBITDA range, FY2026 capex, FY2026 year-end net debt ceiling, FY2026 leverage ceiling) were written to the event shard via apply-guidance.mjs; none were stated by the release as raised/lowered/held relative to a prior figure, so move is null on all four per the no-reaffirmation-without-explicit-statement rule.",
  "drivers": [
    {
      "metric": "overall",
      "direction": "up",
      "explanation": "CEO Stuewe credited strong operational execution and margin management for enabling debt paydown, share buybacks and a stronger balance sheet this quarter.",
      "basis": "company-disclosed"
    },
    {
      "metric": "Revenue",
      "direction": "up",
      "explanation": "Feed Ingredients net sales rose to $1.15B from $936.5M, the largest contributor to total net sales growth; Food and Fuel Ingredients also grew, per the segment tables.",
      "basis": "derived-arithmetic"
    },
    {
      "metric": "Gross profit",
      "direction": "up",
      "explanation": "Feed Ingredients segment gross margin rose to $320.0M from $214.5M, the main contributor to consolidated gross profit growth, per the segment tables.",
      "basis": "derived-arithmetic"
    },
    {
      "metric": "Operating income",
      "direction": "up",
      "explanation": "Nearly all the increase reflects Diamond Green Diesel equity income swinging to $350.0M from $6.0M, per the segment reconciliation; base segment operating income also improved modestly.",
      "basis": "derived-arithmetic"
    },
    {
      "metric": "EBIT",
      "direction": "up",
      "explanation": "EBIT tracks operating income and reflects the same Diamond Green Diesel equity-income swing to $350.0M from $6.0M disclosed in the segment reconciliation.",
      "basis": "derived-arithmetic"
    },
    {
      "metric": "EBITDA",
      "direction": "up",
      "explanation": "DGD sold 348.8 million gallons of renewable fuel at $2.23 per gallon EBITDA, driving Darling's share of DGD Adjusted EBITDA to $389.2M from $42.6M a year ago.",
      "basis": "company-disclosed"
    },
    {
      "metric": "Net income",
      "direction": "up",
      "explanation": "Net income growth mirrors the operating income increase from DGD equity income, partly offset by a higher tax provision ($110.6M vs $4.1M) as pretax income rose.",
      "basis": "derived-arithmetic"
    },
    {
      "metric": "EPS (diluted)",
      "direction": "up",
      "explanation": "EPS growth mirrors net income's rise since diluted share count was roughly flat (160.6M vs 159.7M shares) year-over-year.",
      "basis": "derived-arithmetic"
    },
    {
      "metric": "Cash",
      "direction": "up",
      "explanation": "The company received $280.0M in DGD cash distributions during the quarter and repurchased $73.0M of stock, while also cutting net debt by $223.0M.",
      "basis": "company-disclosed"
    }
  ]
}
