{
  "ticker": "IBM US",
  "period": "FY2026 Q2",
  "reported_at": "2026-07-22",
  "generated_at": "2026-08-10T11:37:47.000Z",
  "depth": "filing",
  "headline": "Software growth lifts revenue, margins and cash flow slip",
  "kpis": [
    { "label": "Revenue", "value": "$17.162B", "delta": "+1.1%", "delta_basis": "y/y", "direction": "up" },
    { "label": "Revenue", "value": "$17.162B", "delta": "+7.8%", "delta_basis": "q/q", "direction": "up" },
    { "label": "Net income", "value": "$2.165B", "delta": "-1.3%", "delta_basis": "y/y", "direction": "down" },
    { "label": "Net income", "value": "$2.165B", "delta": "+78.0%", "delta_basis": "q/q", "direction": "up" },
    { "label": "Diluted EPS", "value": "$2.27", "delta": "-1.7%", "delta_basis": "y/y", "direction": "down" },
    { "label": "Diluted EPS", "value": "$2.27", "delta": "+77.3%", "delta_basis": "q/q", "direction": "up" },
    { "label": "Adjusted EBITDA", "value": "$4.8B", "delta": "+2.1%", "delta_basis": "y/y", "direction": "up" },
    { "label": "Free cash flow", "value": "$2.540B", "delta": "-10.7%", "delta_basis": "y/y", "direction": "down" }
  ],
  "summary_short": "IBM's Q2 FY2026 revenue rose 1.1% y/y to $17.162 billion as Software grew 5% (Red Hat +11%) while Infrastructure fell 7% on a 42% IBM Z decline; net income fell 1.3% to $2.165 billion and diluted EPS fell 1.7% to $2.27, while free cash flow dropped 10.7% y/y to $2.540 billion.",
  "summary_long": "Software revenue grew 5% (Red Hat +11%, Data +19%) while Infrastructure fell 7% as IBM Z dropped 42% against a 37% surge in Distributed Infrastructure; Consulting was flat. Gross margin fell 1.0pt y/y to 57.7% on the mix shift. Net income fell 1% to $2.165B and diluted EPS fell 2% to $2.27, as pre-tax margin slipped to 14.4% from 15.3%, partly offset by a lower 12.6% effective tax rate. Cash fell to $7.2B from $13.6B at year-end after $10.5B of first-half acquisitions; long-term debt rose to $56.2B. IBM updated full-year constant-currency revenue growth guidance to 4-5% and reaffirmed its roughly $1 billion y/y free-cash-flow growth target.",
  "source_url": "https://www.sec.gov/Archives/edgar/data/51143/000005114326000077/ibm-20260722xex991.htm",
  "confidence_notes": "Regeneration (force mode): this summary was force-regenerated per operator instruction; no prior file existed on disk at run time, but the run followed the force-regenerate procedure rather than the normal already-exists guard. Data-quality note: the shard's sourceLink pointed to an unrelated 8-K (a June 23, 2026 Item 1.01/2.03 credit-agreement-maturity-extension filing) rather than the Q2 earnings release; the correct earnings 8-K (filed 2026-07-22, items 2.02/9.01, accession 0000051143-26-000077) and its EX-99.1 exhibit were located via the EDGAR CIK filing index instead — flagging for sourceLink backfill. Adjusted EBITDA uses the company's own $4.8B figure (rounded to one decimal in the release) rather than the shard's Yahoo-derived $4.314B EBITDA KPI, a different non-GAAP calculation, and is reported y/y only since the release doesn't disclose a comparable q/q Adjusted EBITDA figure. Full-year revenue-growth guidance (4-5% constant currency) is stated as the company's current expectation but the release does not explicitly say whether this is raised, lowered, or unchanged from a prior range, so guidance.move is left null for that entry; the free-cash-flow growth target ('continues to expect... about $1 billion year-over-year') is treated as reaffirmed (move: held).",
  "drivers": [
    { "metric": "Revenue", "direction": "up", "explanation": "Software revenue rose 5% led by Red Hat (+11%) and Data (+19%), and Financing rose 12%, while Infrastructure fell 7% as IBM Z dropped 42% against Distributed Infrastructure's 37% growth; the CFO cited 'revenue headwinds late in the second quarter.'", "basis": "company-disclosed" },
    { "metric": "Net income", "direction": "down", "explanation": "Net income fell 1% y/y as pre-tax income margin compressed to 14.4% from 15.3%, partially offset by a lower effective tax rate of 12.6% versus 15.5% a year ago.", "basis": "derived-arithmetic" },
    { "metric": "Diluted EPS", "direction": "down", "explanation": "EPS fell 2% as the 1% net income decline was compounded by a higher diluted share count of 953.3M versus 948.0M a year ago.", "basis": "derived-arithmetic" },
    { "metric": "Adjusted EBITDA", "direction": "up", "explanation": "Adjusted EBITDA rose to $4.8B from $4.7B as pre-tax margin gains on an operating (non-GAAP) basis (19.2% vs 18.8%) offset the GAAP margin decline.", "basis": "derived-arithmetic" },
    { "metric": "Free cash flow", "direction": "down", "explanation": "Free cash flow fell $0.3B y/y to $2.540B; the release attributes discipline in productivity and cash generation but does not itemize the specific cause of the quarterly decline beyond the change in operating cash and capex.", "basis": "company-disclosed" },
    { "metric": "overall", "direction": "down", "explanation": "Cash fell to $7.2B from $13.6B at year-end after $10.5B invested in acquisitions during the first half of 2026; long-term debt rose to $56.2B. CEO Krishna cited AI-driven demand across software and a nearly $500 million Power/Storage order backlog as growth drivers going forward.", "basis": "company-disclosed" }
  ]
}
