{
  "ticker": "300595 C1",
  "period": "FY2026 Q3",
  "reported_at": "2026-10-26",
  "generated_at": "2026-10-27T03:30:00Z",
  "depth": "kpi-only",
  "headline": "Earnings per share rebound sharply from prior quarter",
  "kpis": [
    { "label": "EPS", "value": "CNY 0.19", "delta": "+138%", "delta_basis": "q/q", "direction": "up" },
    { "label": "EPS y/y", "value": "CNY 0.19", "delta": "-3.6%", "delta_basis": "y/y", "direction": "down" }
  ],
  "summary_short": "EPS was CNY 0.19, up 138% from CNY 0.08 last quarter and 3.6% below CNY 0.20 a year earlier.",
  "summary_long": "Only the per-share earnings figure is available on the shard. It more than doubled q/q and was slightly lower y/y. No revenue, margin or cash figures were available, and no drivers or guidance are assessed.",
  "source_url": "https://www.google.com/search?q=%22300595%22+%22FY2026+Q3%22+earnings",
  "confidence_notes": "primary filing unreachable — KPI-only summary — no filing was read; drivers and guidance not assessed. EPS is Yahoo earningsChart data."
}
